{
  "schema-version": 1,
  "pack-id": "shotloom-planning-pack",
  "display-name": "Shotloom Planning Pack",
  "version": "1.0.0",
  "visibility": "private",
  "owner-domain": "repo",
  "description": "Private Shotloom planning workflow pack dry run.",
  "exports": [
    {
      "artifact-id": "shotloom-prepare-task",
      "artifact-type": "skill",
      "path": "skills/shotloom-prepare-task",
      "shape": "directory",
      "mount": {
        "layer": "skills",
        "target": "shotloom-prepare-task",
        "mode": "virtual"
      },
      "entrypoint": "skills/shotloom-prepare-task/SKILL.md",
      "load": "route-selected",
      "route": {
        "context-profile": "shotloom-review",
        "domains": ["shotloom"],
        "repo-keys": ["shotloom"],
        "task-types": ["authoring", "review"],
        "languages": ["rust", "typescript"],
        "work-modes": ["personal"],
        "exclude-when": ["unreal", "obsidian"],
        "min-evidence": 1,
        "priority": 1
      },
      "dependencies": [
        "core:manifest-schema",
        "core:artifact-pack-validation",
        "core:context-routing",
        "artifact:shotloom-planning-pack/shotloom-start-task",
        "artifact:shotloom-planning-pack/shotloom-draft-spec",
        "artifact:shotloom-planning-pack/shotloom-planning-output-contracts",
        "artifact:shotloom-planning-pack/shotloom-planning-local-artifact-paths"
      ],
      "privacy-risk": "needs-scrub",
      "platforms": ["all"]
    },
    {
      "artifact-id": "shotloom-start-task",
      "artifact-type": "skill",
      "path": "skills/shotloom-start-task",
      "shape": "directory",
      "mount": {
        "layer": "skills",
        "target": "shotloom-start-task",
        "mode": "virtual"
      },
      "entrypoint": "skills/shotloom-start-task/SKILL.md",
      "load": "route-selected",
      "route": {
        "context-profile": "shotloom-review",
        "domains": ["shotloom"],
        "repo-keys": ["shotloom"],
        "task-types": ["authoring", "review"],
        "languages": ["rust", "typescript"],
        "work-modes": ["personal"],
        "exclude-when": ["unreal", "obsidian"],
        "min-evidence": 1,
        "priority": 2
      },
      "dependencies": [
        "core:manifest-schema",
        "core:artifact-pack-validation",
        "core:context-routing",
        "artifact:shotloom-planning-pack/shotloom-planning-output-contracts",
        "artifact:shotloom-planning-pack/shotloom-planning-local-artifact-paths"
      ],
      "privacy-risk": "needs-scrub",
      "platforms": ["all"]
    },
    {
      "artifact-id": "shotloom-draft-spec",
      "artifact-type": "skill",
      "path": "skills/shotloom-draft-spec",
      "shape": "directory",
      "mount": {
        "layer": "skills",
        "target": "shotloom-draft-spec",
        "mode": "virtual"
      },
      "entrypoint": "skills/shotloom-draft-spec/SKILL.md",
      "load": "route-selected",
      "route": {
        "context-profile": "shotloom-review",
        "domains": ["shotloom"],
        "repo-keys": ["shotloom"],
        "task-types": ["authoring", "review"],
        "languages": ["rust", "typescript"],
        "work-modes": ["personal"],
        "exclude-when": ["unreal", "obsidian"],
        "min-evidence": 1,
        "priority": 3
      },
      "dependencies": [
        "core:manifest-schema",
        "core:artifact-pack-validation",
        "core:context-routing",
        "artifact:shotloom-planning-pack/shotloom-planning-output-contracts",
        "artifact:shotloom-planning-pack/shotloom-planning-local-artifact-paths"
      ],
      "privacy-risk": "needs-scrub",
      "platforms": ["all"]
    },
    {
      "artifact-id": "shotloom-planning-output-contracts",
      "artifact-type": "config",
      "path": "config/outputs.json",
      "shape": "file",
      "mount": {
        "layer": "config",
        "target": "outputs/shotloom-planning.json",
        "mode": "virtual"
      },
      "load": "manual",
      "privacy-risk": "needs-scrub",
      "platforms": ["all"]
    },
    {
      "artifact-id": "shotloom-planning-local-artifact-paths",
      "artifact-type": "config",
      "path": "config/local-artifact-paths.json",
      "shape": "file",
      "mount": {
        "layer": "config",
        "target": "local-artifact-paths/shotloom-planning.json",
        "mode": "virtual"
      },
      "load": "manual",
      "privacy-risk": "needs-scrub",
      "platforms": ["all"]
    },
    {
      "artifact-id": "json-handoff-packet-template",
      "artifact-type": "doc",
      "path": "docs/document-templates/agent-hub/json-handoff-packet.json",
      "shape": "file",
      "mount": {
        "layer": "docs",
        "target": "document-templates/agent-hub/json-handoff-packet.json",
        "mode": "virtual"
      },
      "load": "manual",
      "privacy-risk": "needs-scrub",
      "platforms": ["all"]
    },
    {
      "artifact-id": "shotloom-planning-manifest-template",
      "artifact-type": "doc",
      "path": "docs/document-templates/agent-hub/shotloom-planning-manifest.json",
      "shape": "file",
      "mount": {
        "layer": "docs",
        "target": "document-templates/agent-hub/shotloom-planning-manifest.json",
        "mode": "virtual"
      },
      "load": "manual",
      "privacy-risk": "needs-scrub",
      "platforms": ["all"]
    }
  ],
  "compatibility-aliases": [
    {
      "alias-id": "shotloom-prepare-task-legacy-path",
      "target-artifact-id": "shotloom-prepare-task",
      "compatibility-need": "old-path-mapping",
      "old-name": "shotloom-prepare-task",
      "old-path": "agent/skills/shotloom-prepare-task",
      "removal-criteria": "Remove after Shotloom planning workflows run from the installed pack and reference scan finds no active agent/skills/shotloom-prepare-task path use."
    },
    {
      "alias-id": "shotloom-start-task-legacy-path",
      "target-artifact-id": "shotloom-start-task",
      "compatibility-need": "old-path-mapping",
      "old-name": "shotloom-start-task",
      "old-path": "agent/skills/shotloom-start-task",
      "removal-criteria": "Remove after Shotloom planning workflows run from the installed pack and reference scan finds no active agent/skills/shotloom-start-task path use."
    },
    {
      "alias-id": "shotloom-draft-spec-legacy-path",
      "target-artifact-id": "shotloom-draft-spec",
      "compatibility-need": "old-path-mapping",
      "old-name": "shotloom-draft-spec",
      "old-path": "agent/skills/shotloom-draft-spec",
      "removal-criteria": "Remove after Shotloom planning workflows run from the installed pack and reference scan finds no active agent/skills/shotloom-draft-spec path use."
    }
  ]
}
